,id,type,author,subreddit,created_at,content
2353,k5wqkso,comment,LemonBerry365,Dizziness,1697937070,Thank you so much. I hope your doing well.
2354,k5mpx47,comment,LemonBerry365,headache,1697765712,Ill definitely try it. Ty
2355,k5mozcg,comment,LemonBerry365,headache,1697765314,Ill try ice.. i use heat on my cheek that seemed to help but not the eyebrow..
2356,k5moima,comment,LemonBerry365,headache,1697765120,Yes! Its been a daily struggle for 2 week straight. My eyebrow even hurts tonight! Like just closing my eye.. have u found anything to help? Trying allergy meds thr last 2 days didnt help day 1..
2357,k5me4vm,comment,LemonBerry365,POTS,1697760793,Yes! I couldn't think of it
2358,k4z2dc1,comment,LemonBerry365,POTS,1697376403,I do get headaches and migraines but not often anymore. What do you do for IIH? I don't think I have EDS. Im glad you got it figured out. Im sorry it took so long to get figured out.
2359,k4xjeqe,comment,LemonBerry365,POTS,1697339414,Ook mines when im standing too. But I was diagnosed with PPPD. But they said lowing down should ease that so i dont think itd from that. I also i guess am weird bc being in a car makes me feel better..  i hope your dizziness stays away!!
2360,k4xa17j,comment,LemonBerry365,POTS,1697334869,It rwally us helpful..
2361,k4x9mww,comment,LemonBerry365,POTS,1697334684,"Yeah it is easier to rationalize with myself.. i had a cardiac work up 2 years ago(when everything started) and then a new echo back in March so I know my heart is ok. Its always the head stuff that gets me. I did find some peace. And if you need to vent, rant or talk to someone who understands im here."
2362,k4x82lc,comment,LemonBerry365,POTS,1697333959,Oh my goodness I have felt alone in most of this. I had an MRI and 2 ct scans and Neck MRI and I still spiral when the huge dizziness like I explained happen. Its like a wave. I have pressure right now in forehead and top of head. Bp is fine.  I really am unsure if its related to POTs or somrthing else. I hope your MRI goes well and you find a peace of mind or figure out what is going on.
2363,k4x7ow8,comment,LemonBerry365,POTS,1697333783,"Oh my goodness its crazy. I get dizzy often when standing more like unsteadiness laying down /sitting is like the dizzy, head pushing, lightheaded feelings..i hope you figure it out."
2364,k4wx2vr,comment,LemonBerry365,POTS,1697328955,Thank you so much and good luck to you as well. I hope you get some answers.
2365,k4wuofo,comment,LemonBerry365,POTS,1697327892,"Yeah its it moves through my head but also feel like im being pushed down on my head. Its such a weird scary feeling bc i felt the presyncope with it and then anxiety for awhile after.  I looked up the hot flashes.  Ice had those before, it makes me like my body is burning up. Im sorry your healthcare system sucks. My doctors seem to shuffle me from specialist to specialist and then back to try and figure this all out. And its hard when they arent on the same page."
2366,k4wsddc,comment,LemonBerry365,POTS,1697326892,I dont get any bleeding or feel like im bleeding. Have you got an MRI? Or ct scan of your face? I used to explain it like a wave going through my head.  Im not sure its related to eating. Maybe I should take that out of there.. I hope you find some answers soon bc this is awful.
2367,k4wg966,comment,LemonBerry365,POTS,1697321745,I have no clue. But its horrible.  I felt faint and just do dizzy. Now forehead pressure. Ill update if i find anything out.
2368,k4mb2cj,comment,LemonBerry365,POTS,1697145899,Have u talked to your cardiologist/neurologist about it? Everytime i go to the specialist they ask me about headaches when  standing. I don't usually get them from standing so not sure why they ask.
2369,k4jv5pc,comment,LemonBerry365,POTS,1697112708,"The specialist wants me to try a low dose med but I need to talk to my cardiologist first... bc my resting hr is already lowish.. this is my doing tho the specialist told me to take it, along with salt pills. But the neurologist agreed with me to ask the cardiologist.  

So for now im doing what i did in late 2021 before diagnosis which was exercise (a tiny bit), low carb and not a lot of sugar.. and seeing if that helps again."
2370,k4g0oro,comment,LemonBerry365,POTS,1697045516,I see a dysautonomia specialist and a neurologist. My neurologist has been a big help in certain areas.
2371,k49g09t,comment,LemonBerry365,dysautonomia,1696938697,Thank you for this. It does help. Yeah I don't think I am going to be able to do the TST sweat test. 1 cost and 2 heat and humidity ans I don't get along all the time.
2372,k47e14f,comment,LemonBerry365,POTS,1696895661,Oh yeah thanks!! I didn't think of that.
2373,t3_17bya79,post,LemonBerry365,headache,1697762078, I wake up and sometimes go to bed with a headache here. It hurts so bad then slowly goes away..  im going for a sinus ct next week but i dont have congestion (that I can feel) I did a month ago have an awful sinus infection though. Also the base of my head is sore on that side with it and it is always on the right side. It makes my back 2 teeth hurt as well.
2374,t3_177ztd5,post,LemonBerry365,POTS,1697319623,"

I was laying in bed and I got this weird quick sensation in my head. So hard to explain but almost like someone pushed my head down 3 times really hard and I was super dizzy almost faint like and then my hr went up a bit as I got scared. Almost like I was gonna faint. Ive had this in 2021 docs never found a reason but didnt investigate much and was before POTS diagnosis. I mean i shouldnt feel faint laying down should i? I will be calling the doc Monday morning.. just wanted to see if anyone has gone through this or similar so I can explain it to the doc better. It happened quickly too and was intense. Now im on edge. Now im super dizzy and anxious, pit in stomach feeling, and forehead pressure !"
2375,t3_17btixs,post,LemonBerry365,POTS,1697749275,"I was cleaning my downstairs for like 5 min, had a powerade right before but anyway. I laid on my couch when and started seeing black spots only lasted a couple seconds. Oh and I was only a tad dizzy. But now my anxiety is super high. Im getting anxiety dizziness, extra saliva, pit in my stomach feeling, its about 45 min after it happened. Has anyone had this before? Was it just floaters? They didnt seem like it but idk. Presyncope epsiode? Idk what else to call it. Ive faitned before back in 2013 and didnt have this. But now im afraid of passing out (biggest fear).

Ive also had like 5.5 hrs of sleep and a sinus headache for the morning. Went away around 11."
2376,k4305w6,comment,LemonBerry365,POTS,1696821105,"I get it. Life happens. Are you are any meds for the pots? Oh that sounds like Chop onr, bikes and rowing machine to get cardio in."
2377,k42vsl6,comment,LemonBerry365,POTS,1696819147, The CHOP one I found online when I saw it mentioned. Ahh the not sharing might be why I cant find that one online. My dysautonomia specialist told me to do exercises and start small and work my waY up. I prefer to workout at home. Does physical therapy help?
2378,k3stvsx,comment,LemonBerry365,POTS,1696643738,I agree completely..
2379,k3sruib,comment,LemonBerry365,POTS,1696642747,I have not heard of it. I will check it out.. im sorry you are dealing with it..
2380,k3s4o2n,comment,LemonBerry365,POTS,1696632045,That would be good. The one that your in a sauna like I wouldn't be able to handle..
2381,k3s3m8w,comment,LemonBerry365,POTS,1696631589,I just got over a sinus infection 2 weeks ago but ive had this off and on for 2.5 years and have asked so much about my sinuses. The Ent looked up my nose and checked a head MRI I had and said they looked good. Its just weird to me. I hope you get the answers you are looking for.
2382,k3rxfbl,comment,LemonBerry365,POTS,1696628992,Ive been doing thebsalt and water increase as well. Right now its ok.  But dealing with just pressure in my forehead feeling :-(
2383,k3rto72,comment,LemonBerry365,POTS,1696627483,Hmmm i might have to try it. Oddly im good when I wake up its mid afternoon I start feeling off.
2384,k3rtiyc,comment,LemonBerry365,POTS,1696627426,Id prefer that to be honest.
2385,k3rtg7e,comment,LemonBerry365,POTS,1696627396,"I got my offical diagnosis yesterday of POts, i also have anxiety and phsycial therapist diagnosed me with PPPd(dizziness condition ) and im struggling with the dizziness part. The doc yesterday said the POTs causes my dizziness. I was having a hard time accepting it and think there is more to it that they are missing. Also my anxiety is from the symptoms, so when i get super dizzy I get super anxious. Or Panicky. Its a cycle for me."
2386,k3rstig,comment,LemonBerry365,POTS,1696627153,I did a 2 min exercise today and made it through so i will take it as a win...
2387,k3r3o0n,comment,LemonBerry365,POTS,1696617770,I read online and the receptionist told me its like your in a sauna.
2388,k3pei1p,comment,LemonBerry365,POTS,1696593878,"I cant take Xanax bc it makes me more anxious. I hope you can find something that works. My doctor told me exercise is super important, have you tried thar?"
2389,k3pe5v6,comment,LemonBerry365,POTS,1696593696,Thank you so much. I woke up today and decided that today would be the day that I try to do it. So we will see how it goes later.
2390,k3o8f5o,comment,LemonBerry365,POTS,1696563387,Pretty much.. honestly id rather do without meds bc taking meds since this all started 2.5 years ago makes me anxious.
2391,k3o8231,comment,LemonBerry365,POTS,1696563193,"Thats what happened to me on metoprolol, fatigue, dizzy, short of breath."
2392,k3nvpr3,comment,LemonBerry365,POTS,1696557374,Im finding the same with beta blockers. Im hoping this one isnt bad but he has me on a small dose to start.
2393,k3nv62e,comment,LemonBerry365,POTS,1696557137,Thank you. Ive had pT with a vestibular therapist back in 2021. I might need to do it again. Im hoping even if it tones down a bit I can handle it.
2394,k3nuyob,comment,LemonBerry365,POTS,1696557045,Oh no. I have tried metoprolol and propranolol before and I couldnt handle the sude effect of either one.
2395,k3nusy7,comment,LemonBerry365,POTS,1696556974,My bp us within normal range except when standing apparently it dropped a little bit. I'll have to look into the med and ask the doc. Thanks
2396,k3nkr8a,comment,LemonBerry365,POTS,1696552674,"Thank you.

 This doctor is a dysautonomia specialist. He is certain after my TTT its Pots, he said he is trying to see if their is an underlying cause for it. I also don't handle heat very well at all, so this is not going to go well at all."
2397,k3n8q2w,comment,LemonBerry365,POTS,1696547480,Mine varies as well.
2398,k3n8anl,comment,LemonBerry365,seizures,1696547296,"I have almost the same symptoms. And they come so randomly or stop randomly, skipped a year, it came back. MRI, ct scan, Eeg both normal. My symptoms started as a in 2021
- weird wave like of dizziness
- tingling starting at feet going up my body
-Heart racing
-Shaking legs
-Anxiety 
-Flushed
-Sweaty palms
-Feel like im gonna faint(the tingling and dizziness) give me this feeling. As ive fainted before in 2013

Mine last under a min, probably under 30 seconds except my heart and legs take a little bit to calm down. Then after im able.to just continue on with my day except being scared it will happen. Im completely aware of my surrondings and everything. 


Now in 2023
-That weird feeling in head 
-Pit in stomach
-Tingling in face/mouth
-Weird taste almost sweet some docs think !adrenaline 
-Legs shaking 
-Heart racing
-Sweaty palms 
-Anxiety feeling

And the same as before they happen quickly, and randomly. Like 1or 2 a month for a couple of months"
2399,k3n79oc,comment,LemonBerry365,Dizziness,1696546856,Thank you !
2400,k3n6n6y,comment,LemonBerry365,POTS,1696546588,Thank you. Its my main complaint and I was just hoping there would be something that would help.
2401,k3kqxyz,comment,LemonBerry365,POTS,1696514584,Oh no im sorry.  I have an appointment with my dysautonomia specialist today and will ask about PT. Im glad its working for you.
2402,k3kmjk7,comment,LemonBerry365,POTS,1696512763,Thank you. I will definitely look into it! Earlier this year I was doing weights at home with 10-20lbs depending on the exercise and I had a set back.  Now just neevous.
2403,k3ipzgn,comment,LemonBerry365,POTS,1696471346,Thank you. I can do a few squats/calf raises now. Im just so scared of getting that dizzt/faint feeling again. Maybe i need to just start on the floor to get over the anxiety of it all.
2404,k3i1wbj,comment,LemonBerry365,POTS,1696461437,Thank you!!!
2405,k3gji37,comment,LemonBerry365,dysautonomia,1696441973,I have read that deconditioning can cause symptoms to flare up a lot. I can tell that last year I was exercising and out of bed a lot and doing so much and felt so good! But this year after being sick with a virus along with my kids being sick and being in bed i slid backwards it feels like.
2406,k3crefk,comment,LemonBerry365,POTS,1696374469,Im so sorry that happened. I hope you get it figured out.
2407,k3cr9a6,comment,LemonBerry365,POTS,1696374411,Im glad it helped you.
2408,k3cdo6b,comment,LemonBerry365,POTS,1696369139,"Like you feel like yes I have the POTs. Get my results Thursday but the doctor is certain based on symptoms and stuff. Anyway I feel like I have more going on. The TTT brought up my hr, i also started panicking for some reasons, calves were tight, dizzy and flushed. The dizziness is an everyday complaint almost.  But I have other symptoms that the test didnt bring out, well epsiodes. I hope you get your answers soon or figure it out. The unknown adds a lot of anxiety for me. 

No other symptoms for me that you posted."
2409,k3ccw0y,comment,LemonBerry365,POTS,1696368866,I cant take Xanax bc it made my anxiety worse and symptoms worse. I took a small dose of another benzo for a dental appointment that they prescribed me and it didn't mess with me at all. I could actually see a decrease in my dizziness too. Id definitely talk to your doc though about your concerns. They would be best to guide ya through it as everyone is different
2410,k3ccek6,comment,LemonBerry365,POTS,1696368692,I am worried about this. Im not on meds at the moment but my resting hr is 50-60 even sitting up earlier I was at 58. So not sure if I want to even chance meds. Its a good conversation to have with your doctor.
2411,k3cbj72,comment,LemonBerry365,POTS,1696368385,Oh no. I hope it doesn't happen.
2412,k3cbgnp,comment,LemonBerry365,POTS,1696368360,Oh my. I dont know how I missed your reply.  But I cant imagine. Does anything help?
2413,k3bb23g,comment,LemonBerry365,dysautonomia,1696355816,Ive tried buspirone.  It helped at first. They tried small dose Xanax but it made me worse... docs reallt dont know what it is bc it came out of no where and didn't have any anxiety prior to this happening.
2414,k3apxtc,comment,LemonBerry365,dysautonomia,1696348196,"Yes my anxiety only pops up with the symptoms so like if I get dizzy then ill get anxious.. never really have the racing thoughts until then. I too had a bone marrow biopsy and was cool as a cucumber but my TTT threw me into crying and panicking during the standing part..  my therapist even thinks that my anxiety if it wasn't for the symptoms and unknown of whats going on would be gone or significantly lessened when the dizziness pops up. I had these weird out of no where epsiodes/attacks that started all of this back in 2021 and I had to learn that not every feeling I feel would send me into 1 of those. The doctors and ive seen plenty since then still have no clue what they are. 


In 2021 I had :
Tingling in feet working up body 
Got super hot
A quick wave like feeling(dizziness maybe)
Felt like I was going to faint
Racing heart
Legs shaking
Palm's sweaty 
Flushed afterwards 

They only lasted under a min, except the hr N legs shaking took a bit to calm down. It happened out of no where and from end of feb 2021-may of 2021. 

After that the dizziness stayed (Pppd im told)and all these weird symptoms. I couldnt go into stores, reasturants, walk a lot, i had anxiety being alone, it was horrible. 


Then in 2022 i was fine-ish i was able to exercise, go into stores for about 15-20 min before id get to hot and dizzy, i ate in a few reasturants, walked the beach, went to an arcade for an hour, get togethers ect..  even moved across country. 

2023 end of March BAM they started again but thus time it was:
Tingling in mouth
Weird tatse kinda sweet(maybe adrenaline)?
Pit in stomach 
Faint feeling
The wave like feeling in head
Heart racing 
Legs shaking
Palms sweaty


Ive been told SVT(ruled out), anxiety, im a mystery, shuffled around from specialist to specialist. Had an EEG for focal seizures, MRI(clear), 2 Ct scans head(clear), EP study,  i have an internal loop recorder, lots of blood work, therapy.. My hematologist scanned my chest, abdomen and pelvis just to check as well. 

Now i see a dysautonomia specialist and he said he thinks POts. Had the poor mans Tilt in his office which my hr went up and sustained, so he pretty much said POTs, had the TTT and my hr definitely went up and stayed up however I started to panic at 6 min in.. idk why.. i cried and begged them to take me down. I didn't feel like fainting or anything. But it also dosnt recreated those episodes i get either. 


Sorry this was so long."
2415,k39jycn,comment,LemonBerry365,COVID19positive,1696329054,I had an awful sinus infection on top of whatever we had but antibiotics cleared it up.  Im feeling almost back to normal (well normal for me). I wake up with garbage in my throat some mornings. How are you?
2416,k39jjvx,comment,LemonBerry365,dysautonomia,1696328764,"Yeah this is true. My anxiety comes out when symptoms flair up, especially when I get dizzy and makes things worse.."
2417,k38bq1p,comment,LemonBerry365,headache,1696299745,I get this along with pain in the forehead/ top of head.
2418,k38bk72,comment,LemonBerry365,headache,1696299675,Do you get neck pain too? Or pain at the base of your skull? Pretty sure mine is tension as well.
2419,k3891pf,comment,LemonBerry365,Dizziness,1696298605,"Im still learning this, as I have chronic dizziness, pppd. My therapist and I are working on the thought process.."
2420,k388tks,comment,LemonBerry365,Constipation,1696298505,Haha yeah no lol
2421,k388iyl,comment,LemonBerry365,Constipation,1696298374,Thank you
2422,k3872jx,comment,LemonBerry365,dysautonomia,1696297766,That's pretty much what I go through :-( byt id say 90% of the time being the car helps me.. the other 10% it makes it worse and I just need my bed.   I am sorry you deal with it as well. Its frustrating and scary..
2423,k37jhhn,comment,LemonBerry365,dysautonomia,1696287990,Thank you
2424,t3_16zz8aw,post,LemonBerry365,POTS,1696454946,"What exercises do you all use or program when you cant get to a gym? Im so scared to restart exercising again. I had to stop since the end of March when I after a year of exercising decided to try a quick HITT work out got faint 15 min after I was done. My aunt said I went pale, my eyes got really wide but never fainted and that set off well almost daily dizizness and me being anxious to do anything :-(.. 

I go tomorrow for my official diagnosis although the doc is certain I have it. He even wrote it on my diagnosis already for my insurance... my hr 100% jumps and stays high usually 113-130... highest recorded was 177.."
2425,t3_170t7dl,post,LemonBerry365,POTS,1696539617,"Got my offical diagnosis today. And the doctor put me on atenolol. Has it helped anyone? Has it helped your dizziness? Thats my main complaint... 

He also ordered a bunch of blood work and a sweat test to see what kind of POTs I have did anyone have this done? I looked up the sweat test and it has me worried as 1. I cant stand being in a hot or humid environment and 2. I read stuff about pure autonomic failure and other stuff and that scares me."
2426,k378ie8,comment,LemonBerry365,dysautonomia,1696283491,Thank you. My guess was both but idk. I have so many docs with so many ideas bascially. My new Pcp was the first to say I think there is a lot more going on then anxiety.  My neuro thought dysautonomia and or focal seizures but nothing showed up on EEG so sent me to another specialist (dysautonomia) i am so tired of being passed around bascially.
2427,k338ee7,comment,LemonBerry365,Constipation,1696214094,I just did. Thank you
2428,k32xkg2,comment,LemonBerry365,POTS,1696209413,Yeah. Its a big fear of mine. The doctors haven't called back. So gotta wait til tomorrow. I really don't want to go through the embarrassment of going to the doctors to get impacted stool taken care of :-(
2429,k32w2sd,comment,LemonBerry365,etd,1696208782,"Ive had my ears clogged and ear drum retracted on both sides N was in pain but not unbearable. Did they check your ears for infection? Could be an ear infection.  Mine were clogges due to an awful sinus infection. It was so bad, so I was using saline mist then the doc told me to try a saline rinse, and I tried flonase before that and warm compresses when they were sore and my cheeks hurt from the sinus infection. I hope you feel better soon!!"
2430,k32pw32,comment,LemonBerry365,etd,1696206175,Mine are unclogged and better now! They have a popping noise off and on or crackling maybe a few times but better!  Im so sorry yours aren't better and it is taking a while and covid messed you up.
2431,k32eg5u,comment,LemonBerry365,Dizziness,1696201299,Not usually. I did a few times but that was only when I had a lack of sleep for like a week when I was sick.
2432,k315jnh,comment,LemonBerry365,Dizziness,1696184796,"Yes my anxiety came afterwards and I was normal the next day as well. My pppd never came with vision issues. Mine makes me feel like im on a boat when lying down or sitting and then standing felt like im swaying or being pulled side to side almost like watching a drunk person walk. Its just crazy and has prevented me from so much.  Thats crazy you had them off a year as well. I wonder what they could be. Ive had a clear MRI, ct scan of head, neck ct showed something like normal wear and tear or something but neuro and ortho doc both said wouldnt be causing me to be dizzy like i am. I was checked for seizures even but my eeg was normal. But i was told they only detect if your having seizure activity at that time."
2433,k30dqyx,comment,LemonBerry365,Dizziness,1696174625,"I have no idea. Out of no where in 2021 I got a wave like of dizziness in my head. Tingling in feet working up my body. Body got all hot, heart racing, legs shaking. And flushed afterwards. It lasted under a min. Except my hr and legs took a bit to go back to normal. I had it end of feb to mid April and about 4 of them. 

I had 0 of these in 2022, then in 2023 they started again. Only this time i got tingling in the mouth and a weird taste and pit in stomach feeling. Docs cant figure it out."
2434,k30dckq,comment,LemonBerry365,Dizziness,1696174469,No I have not. Besides regular checks at the eye doc.
2435,k2w10rm,comment,LemonBerry365,Dizziness,1696095359,"I have had this drunken feeling when walking, or when laying a boat rocking feeling for 2.5 years now off and on. First year it was everyday, 2022 i got better and since april its been there mostly every day again..  I hope you find your answers."
2436,k2w0gxv,comment,LemonBerry365,POTS,1696095154,"Whatever was happening to me back in 2021 caused my hr to go up upon standing by a lot. And it was sudden. Docs said SVT but not proven by ekg, dysautonomia specialist says POTS now, told anxiety too."
2437,k2s8bip,comment,LemonBerry365,POTS,1696024408,Thats a good way to explain it. Mines never a spinning dizziness so i guess that would be right. Sometimes I say like im drunk but without being drunk too. But i get funny looks sometimes from docs. And i dont drink anymore..
2438,k2qemr7,comment,LemonBerry365,Dizziness,1696000337,"Thank you so much. Weird thing is my ear drums were retracted and ears clogged and I had less dizziness than I do now. Docs say anxiety some say PPPD, some just dunno. I am not in oregon but I am in the US. That would be great. Thank you."
2439,k2qbsik,comment,LemonBerry365,Dizziness,1695999286,"Oh wow thank you for this. Last year I was able to do so much, exercise, walk on the beach, go into stores, ect. Now since march/ april not so much. Its peaked my anxiety too. Which my pcp and Therapist agree the anxiety is coming from the symptoms bc im fine until they hit :-( I had vestibular therapy. It lasted 6 weeks and since I was getting somewhat better they graduated me and said come back if things get bad again and we eneded up moving last year. Maybe I need to find a new one.  Im on week 3 of battling some virus on top of a sinus infection so could be why I am feeling off the last couple of days. On top of lack of.a full nights sleep.  I am glad your 95% better and I hope you can kick the last 5%."
2440,k2po4zs,comment,LemonBerry365,Dizziness,1695989470,Thank you. The anxiety amplifies everything.
2441,k2ohcsy,comment,LemonBerry365,Dizziness,1695960546,I was diagnosed with PPPD by a vestibular therapist and therapy back in 2021 but my neuro doesn't agree with it fully and 1 of my other docs thinks its anxiety so they really dont know lol.  I just had the vestibular therapy. I was given meclizine to try too and it didn't do anything.
2442,k2ogm7n,comment,LemonBerry365,Dizziness,1695960154,Thank you. Today was just a bad with it. Ill try ginger tea thank you. Usually I have a lemon zinger its calles. I just wish the docs knew what was causing it. Ive gotten so many different could be causes.
