,id,type,author,subreddit,created_at,content
661,t3_109tjtt,post,Fit_Dimension_9517,flu,1673508526,"I've never had to change my clothes so many times due to cold sweats, my hair gets soaked behind the back of my neck it's uncomfortable. First I got off work was thinking just exhausted from that, but then my lymph nodes are swollen for a few days, sore throat appears out of nowhere in a day, hurts to yawn/swallow. But when I looked nothing seemed red just hard to look at the back of my throat because I couldn't open my throat any bigger, it felt like it was getting smaller. Freaked me out, took rapid COVID test neg. Went to bed would wake up really hot skin felt on fire/cold sweats) might of had temp idk Took another COVID test in am, neg. Minute clinic, strep test neg, no fever, Getting body aches that would come in waves lasting hours, really bad migraine/headaches all day, with body aches (tried Epsom salt/headache relief/Excedrin) not much of any relief. Had fever, more aches/cold sweats during night, fever all day, loss of appetite, (I think I've lost six pounds) things smell different somewhat too (can't tell you why, I lost taste/smell with COVID when I got that second time when it was actually COVID and the world knew about it) weird palpitations, woke up startled/pulse racing strange dreams aren't new to me (usually have nightmares) but something felt different about it.. I'm tired of feeling this way"
662,k8ie1vu,comment,SageFreke86,Jeep,1699543081,Fr tho someone tried to break into my house the other night at 3am. Took the footage to police and they haven’t done shit. Haven’t seen them around my neighborhood like they said either…..
663,k8e7evo,comment,SageFreke86,COVID19positive,1699470059,I tested negative after 8 days. Everybody is different when it comes to Covid. Hard to give an answer
664,k8dlygm,comment,SageFreke86,COVID19positive,1699462367,Yeah I believe Greek yogurt has probiotics in it. Not sure about regular
665,k8d6nn8,comment,SageFreke86,COVID19positive,1699456703,Antibiotics usually cause diarrhea. Try taking some probiotics. I don’t really know how to answer because I’m not a doctor. I apologize. But if they prescribed something then you should take it is my advice
666,k8b3203,comment,SageFreke86,flu,1699412093,It took me a good like 12 days to finally feel better. Granted I had flu B and Covid but apparently they’re similar in symptoms this time around.
667,k8awlso,comment,SageFreke86,BanPitBulls,1699409352,My golden retriever was attacked twice on two separate occasions at a dog park by a pit bull. He did nothing to provoke. Pitbull literally ran up to him and grabbed him by the neck and wouldn’t let go. My golden went submissive and did nothing while he had his neck. Luckily no damage was done or blood shed. I have a good friend who’s neighbor in her apartment buildings pitbull attacked her visiting uncles small dog. The dog had to have its eye removed and almost died. Also an unprovoked attack. Another friend of mines Labrador was nearly killed by a neighbors pitbull that got loose
668,k8aa0jv,comment,SageFreke86,emetophobia,1699400028,"Terrible headache and body aches/muscle pains, fever for a day, no appetite, diarrhea for 2 days, fatigue, congestion for 3 weeks, I also had Covid at the same time so not sure what symptoms were from what"
669,k8a36gg,comment,SageFreke86,emetophobia,1699397333,I got the flu shot few months ago and had the flu really bad like 3 weeks ago. I think they “ guessed the wrong flu strain” this year because it def did nothing for my flu and being “not as bad”
670,k89uc36,comment,SageFreke86,RoverPetSitting,1699394044,Imagine having 2 grand to throw away for a pet sitter? God I wish.
671,k89cxjv,comment,SageFreke86,flu,1699387786,I felt the same way and I had both flu and Covid
672,k894pih,comment,SageFreke86,COVID19positive,1699384808,You’ll be fine. I’m 30 and I got over it in about 8 days. And had flu at same time. You’ll be alright!  I also had the same headache for 2 days and mega body aches. Fever for a day then just congestion for a couple weeks
673,k88kdvm,comment,SageFreke86,Interstitialcystitis,1699377571,I don’t think I’m going to take it anymore. I’ve been having burning/painful diarrhea  since taking it
674,k87k2fy,comment,SageFreke86,labrador,1699363313,Ugh I’m sorry :/. I stopped going to dog parks because my golden got attacked by a pit bull twice. And I was watching the whole time he did absolutely nothing to provoke it. He was just running around minding his business. He was even submissive and scared when the thing wouldn’t let go of his neck. The owner was nowhere in site. I wanted to kick the fucking shit out of that dog but I didn’t. Learned my lesson with dog parks after that.
675,k85vfs9,comment,SageFreke86,COVID19positive,1699325073,Probably was a false negative.  But if the line is very faint now you might be recovering soon!
676,k85pyhe,comment,SageFreke86,emetophobia,1699322808,I was shittint myself and tu* at the same time
677,k85hewn,comment,SageFreke86,flu,1699319292,I had flu B and I was fine. Granted I did go to urgent care to get tested for it. They gave me tamiflu. I also had Covid at the same time
678,k858ste,comment,SageFreke86,COVID19positive,1699315789,I’ve been having on and off nausea post Covid. Tested negative after having it for 7 days   Positive October 20th. Negative by oct 28th.  Still been having some nausea here and there. Not sure if it’s GERD or from Covid though
679,k82lmfn,comment,SageFreke86,Interstitialcystitis,1699280735,Will do. Did you only take it for a few days?
680,k807j12,comment,SageFreke86,Interstitialcystitis,1699230656,This post is OLD AF but I have been taking d-mannose the past 2-3 days and every time about an hour later I get horrible nausea! I’m thinking it’s the D-mannose. It says serving size is 3 capsules and I took 2 at once after dinner
681,k7zuqaq,comment,SageFreke86,goldenretrievers,1699225667,Yep I do
682,k7zc9ex,comment,SageFreke86,videogames,1699218757,Ghost of Tsushima is a master piece
683,k7xcvzu,comment,SageFreke86,NameMyCat,1699192468,Dobby
684,k7vo1j7,comment,SageFreke86,emetophobia,1699152828,Food poisoning is usually anywhere from 4-48 hours to personally in my experiences it was always within like 6 hours. I wouldn’t stress it.
685,k7velr8,comment,SageFreke86,COVID19positive,1699148663,I’m doing a lot better. Covid free and diarrhea ended up being from the flu. Only lasted a couple days. Thank you for asking
686,k7v2l05,comment,SageFreke86,Catnames,1699143685,Pepper /peppers is cute.  Stick wit ittt!
687,k7v1ltb,comment,SageFreke86,Wellthatsucks,1699143284,"The hardest thing in the world is losing a dog/pet. I lost my husky Skylar over 2 years ago and I still find myself crying about it. You’ll never NOT have that pain.. they take a piece of our heart when they leave. I’m so sorry for your situation and I completely sympathize. Skylar couldn’t walk anymore his last few days here and found out the poor guy had a shattered leg and aggressive bone cancer when the mobile vet came to put him to rest. He and your girl have lived a full life of unconditional love, treats, and they will forever live on in our hearts and memories."
688,k7spxi4,comment,SageFreke86,COVID19positive,1699111112,I would continue using them in my opinion
689,k7snlax,comment,SageFreke86,COVID19positive,1699110174,Yes it can be detected by nose. I had nose swabs done and was positive for Covid and flu
690,k7sjuk3,comment,SageFreke86,Wrangler,1699108628,My mother grew up on manuals and got a 2018 mojito 4door manual and immediately hated it.  Tired of shifting lol
691,k7sdu29,comment,SageFreke86,COVID19positive,1699106076,I find it crazy the doctor didn’t do a nose swab for Covid or the flu
692,k7of4pu,comment,SageFreke86,COVID19positive,1699032883,Who wouldn’t be frustrated dealing with this crap? And obviously it’s more than just a “cold” like people say. It has also affected my mental health.
693,k7nutr0,comment,SageFreke86,JeepGladiator,1699025471,"Well, you are 16 so it checks out"
694,k7nja4l,comment,SageFreke86,COVID19positive,1699021097,"Covid is different for everyone. For me I tested negative on day 8 and have been fine since. As to the other persons comment it really would suck to be in another country with Covid and your body definitely could use the rest to battle it better. So it’s a rather tough decision you have there! Very smart on the travel insurance, if you have time I would just wait a little longer and try testing yourself again before your travel plans and if you’re still positive then cancel?   My thoughts still is “life needs to go on”. I was fricken stir crazy after doing the 5 day quarantine. And I did go out in a mask after the 5 days but I made sure to wash hands and stay clear of people. So I understand wanting to go on with plans completely. As long as you are smart about it. :)"
695,k7nf95d,comment,SageFreke86,COVID19positive,1699019493,Docs recommendations are quarantine 5 days then mask 5 so I don’t see a reason why you couldn’t go as long as you wear a mask 🤷‍♀️   I’m the only one in my household who got Covid granted I was constantly washing my hands and stuff to try and prevent spreading it.   This is just my opinion on the matter. I’m sure others will have a different say.
696,k7nd4n9,comment,SageFreke86,COVID19positive,1699018627,I’m in a household of 3 and I’m the only one who ended up with Covid. They did catch the flu from me but never Covid and it’s been over 2 weeks now
697,k7ncugi,comment,SageFreke86,COVID19positive,1699018510,I had flu and Covid at same time and other family members only had flu and 2/3 of us had crazy peeing even though we barely drank and I had lower back pain. Although this was during our illness not after. Doctor sounds like a good idea. Oh I forgot to mention I also had a UTI during Covid and flu
698,k7ncozb,comment,SageFreke86,COVID19positive,1699018446,I tested negative on day 8
699,k7n5r1l,comment,SageFreke86,JeepGladiator,1699015373,LOL. I was anti mask since Covid started. Then 2 weeks ago I caught Covid and flu from someone coughing near me. Now I will forever wear a mask in public. To each their own….
700,k7n5km7,comment,SageFreke86,emetophobia,1699015289,If it was me in that predicament I would get some anxiety meds from my doctor for my flights! Just food for thought
701,k7n4oje,comment,SageFreke86,COVID19positive,1699014872,Western Massachusetts.  Caught it at a table top game store playing DND lol. Tested positive 10/21. Negative on 10/28
702,k7n4hg6,comment,SageFreke86,COVID19positive,1699014779,I’m assuming it is. I’m not sure if it was from the flu or from Covid. That’s the only crappy part of having both lol
703,k7lcpoq,comment,SageFreke86,batman,1698975021,Something bad about this movie.
704,k7lc693,comment,SageFreke86,gaming,1698974800,"by Azura, it's The Grand Champion! I can't believe it's you standing here next to me."
705,k7lbvem,comment,SageFreke86,gaming,1698974676,“Could you spare a coin for an old beggar?”
706,k7l5t5v,comment,SageFreke86,emetophobia,1698972264,I had McDonald’s tonight and felt like my mcchicken was off and was worrying about food poisoning too. Symptoms can start anywhere from like 4-48 hours. But I been sitting here thinking to myself. Is it really worth it to freak out for 48 hours? I feel like if it’s gonna happen then it’ll happen sooner rather than later. So that kinda calmed me down a bit
707,k7l4vbq,comment,SageFreke86,emetophobia,1698971898,I’ve noticed real nausea tends to come more from the stomach as to anxiety nausea feels it in the throat
708,k7kid36,comment,SageFreke86,emetophobia,1698962948,Yeah it was pretty awful 😭😭 emetophobia sucks!!!
709,k7kag0j,comment,SageFreke86,emetophobia,1698959967,For me was norovirus back in march. V* and diarrhea at the same time all night 🥲
710,k7kabqo,comment,SageFreke86,COVID19positive,1698959923,"Thank you I appreciate it. My taste was a little off when I was going through it, it definitely sucks. Everything tasted like salty and just not normal. He’ll get it back though and be able to enjoy his favorite foods again.❤️"
711,k7k9rwe,comment,SageFreke86,JeepGladiator,1698959719,"So I went from a 21 Willys gladiator to a 22 Rubicon gladiator and the ride definitely feels smoother in the Rubicon the willies also had mud tires so that definitely impacted the ride. My willies was also a soft top and the Rubicon is a hardtop. I miss the soft top sometimes, but I do have the headliner as for speed I don’t usually go above like 73 on the highway but I haven’t had any issues with it not feeling stable. Mine is completely stock though"
712,k7k5y4w,comment,SageFreke86,Trophies,1698958329,"I’m missing ONE trophy in Diablo 4 which is get to level 100.  Im level 90 and the grind is just unbearable for me. I can’t do it anymore. Same with my Bf we both need the same thing and the end game is just terrible, repetitive and the grind is 🤮🤮"
713,k7k4d60,comment,SageFreke86,JeepGladiator,1698957753,"
I was never a JEEP person until I got a gladiator. When I saw the concept for it before it was officially released. I fell in love with the look granted my family has had wranglers for years decades even I definitely am a JEEP person now after having my gladiators , this is my second gladiator, so I guess you won’t really know unless you do or don’t get one lol I will add in that I have had a Silverado before it was a 2014 that I bought brand new and personally for me. I like the gladiator way better I’m not really a full-size pick up kind of person I don’t need a full-size pick up either. The Silverado was huge feeling but the gladiator to me doesn’t feel small either, it has a generous amount of room especially on the inside compared to the other midsize trucks. If I’m not mistaken, I believe the gladiator might be the number one with the most room from a video I saw on YouTube I could be wrong so don’t quote me on that, but if you don’t need a full-size truck and like the idea of having a convertible pick up, then I would say go for it"
714,k7k33dk,comment,SageFreke86,COVID19positive,1698957290,"The only thing that is lingering for me is a tiny bit phlegm in my throat Covid did take a huge hit on my mental health though from quarantining etc. I was going very stir crazy I don’t do well being cooped up in the house that long lol despite being negative now and no longer being sick from flu or Covid I certainly still don’t feel 100%. I would say 90 but still experience, some fatigue and tiredness."
715,k7k2lxq,comment,SageFreke86,COVID19positive,1698957116,"So I just had flu B and Covid at the same time so for me, it’s very hard to tell you what my Covid symptoms were because I feel like they were very close and similarity. I did have a fever for a day and a half, but even after my fever broke, I still felt like I had a fever, but my temperature was normal and that lasted a couple days, I feel very fortunate because I got rid of both in about nine days. I only lost my smell for three days as soon as my smell came back on day nine I tested for Covid again and it was negative and I’ve been fine ever since I hope you and your familyrecover sooner rather than later Covid can be so random for everyone. One of my friends had a cough for three months, and I barely coughed at all."
716,k7j1xgw,comment,SageFreke86,JeepGladiator,1698943892,Obviously a troll
717,k7i001q,comment,SageFreke86,emetophobia,1698929210,I just got over Covid and the flu a few days ago. I had a couple days I was nauseous but never got sick
718,k7ekt4x,comment,SageFreke86,COVID19positive,1698866111,I lost my smell for 3 days about 5 days in
719,k7e48z8,comment,SageFreke86,COVID19positive,1698860098,Idk if it’s just like getting older for me but I feel like my vision has gotten a tiny bit more blurry
720,k7e1wry,comment,SageFreke86,emetophobia,1698859256,I said it doesn’t work for my emetophobia lol
721,k7b4mst,comment,SageFreke86,COVID19positive,1698801113,I managed to avoid it until 2 weeks ago. I still sanitize my hands everywhere. I stopped wearing masks when the mandate was gone. Ended up catching it from someone coughing their lungs out at a table top game store playing dungeons and dragons. Now I will be wearing mask again lol
722,k7arcnq,comment,SageFreke86,CasualConversation,1698795247,Same exact reason as OP.
723,k7amzzu,comment,SageFreke86,emetophobia,1698793326,Glad it worked for you. I’ve been on SSRI for over 5 years and it doesn’t affect my emetophobia or anxiety at all.
724,k73z1sf,comment,SageFreke86,mildlyinteresting,1698684964,I’ve been sleepin with dogs in my bed for like 20 years and I never got scabies ☠️☠️ I also bath and brush my dogs atleast once a month though. Most people don’t do that.
725,k73rnry,comment,SageFreke86,XboxSeriesS,1698682214,"I have Xbox series x, ps5, Nintendo switch, steam deck and a gaming PC if that counts"
726,k73ag79,comment,SageFreke86,PCOS,1698675490,Pms or PMDD.  I have PMDD and tend to get to a scary level of depression before my period. This past week before my period I actually was having suic**al thoughts
727,k735sm8,comment,SageFreke86,JeepGladiator,1698673522,To each their own. I think sarge green is a gorgeous color
728,k72t333,comment,SageFreke86,flu,1698667205,Flu strain B
729,k71cbmp,comment,SageFreke86,emetophobia,1698631173,"Hydroxizine, zofran and cold air"
730,k71bzvr,comment,SageFreke86,flu,1698631024,You should check out the emetophobia Reddit group
731,k71brl2,comment,SageFreke86,flu,1698630920,I had the same symptoms minus coughing and I. Tested positive for Covid and flu B
732,k71bmtg,comment,SageFreke86,flu,1698630860,Jesus if I got the flu once every 2 months I would off myself lol. I just got over flu B and Covid in 9 days.. hope you feel better soon maybe try to avoid places where your getting sick so frequently
733,k717g0o,comment,SageFreke86,emetophobia,1698628994,The flu and Covid are going around like WILDFIRE right now. If it makes you feel any better I just had Flu B AND Covid at same time this past week and I never tu*. I had some days where I was nauseous and had diarrhea but never tu*
734,k713sic,comment,SageFreke86,Wellthatsucks,1698627394,"Just had it for the first time too. Tested negative after 9 days and already better now. Lost my smell for 3 days and was extremely tired,congested etc"
735,k6ychpb,comment,SageFreke86,AskReddit,1698589004,People calling the devils lettuce Zaza or loud etc. like it’s just fuckin weed. Wtf is ZAZA?? Idk maybe it’s just me but it’s stupid as shit
736,k6y8n31,comment,SageFreke86,COVID19positive,1698587200,I’ve had more depression than anxiety with this virus. I tested negative yesterday on day 9. Symptoms are gone and smell came back but still have some mental issues from this horrible week 🥲
737,k6wfl43,comment,SageFreke86,PCOS,1698543844,"I get a period every month. But it’s usually quite heavy which is very annoying. I was advised not to use birth control by my gyno. I have some hirsutism and bad cystic acne that I tend to get like all over (face, shoulders, downstairs sometimes)"
738,k6welaj,comment,SageFreke86,gamingsuggestions,1698543361,Stranded deep
739,k6we7w4,comment,SageFreke86,Jeep,1698543182,Also highly doubt they would fit. Only chance you would have is if they came off a 18+ wrangler unlimited
740,k6tvw1u,comment,SageFreke86,COVID19positive,1698506500,I tested negative today on day 9
741,k6rewt3,comment,SageFreke86,emetophobia,1698455401,I also have dentist anxiety and tend to get so worked up for my app that I’ll feel sick in the waiting room. But I always feel relieved as soon as I finally get in there and get started. The anxiety goes away. You could talk to your doctor about anti anxiety meds for your dentist appointments. Whenever I have to get heavy work done they give me a couple lorazapams then I just waltz in there like get er done doc 🤣. My coping mechanism for nausea has always been cold air. Like sitting in front of a fan or air conditioner. It really does help and is better than eating something. Give it a try!
742,k6r6a9k,comment,SageFreke86,Jeep,1698451489,Jesus Christ this again? Don’t you have anything better to do with your life lol
743,k6qlqiu,comment,SageFreke86,COVID19positive,1698442531,Thanks I appreciate the kind words. I think once my 10 days are up and I get back my regular routine it will slowly get better. I haven’t seen anyone or socialized in 8 days
744,k6ql1dr,comment,SageFreke86,COVID19positive,1698442245,I had flu and Covid and honestly don’t know what my symptoms were for. I had diarrhea for a day and nausea but no vomiting
745,k6qki01,comment,SageFreke86,COVID19positive,1698442025,I’ve been on an SSRI for over 5 years now   Might try to take some supplements. Don’t wanna risk seretonin syndrome either though 😅   It’s also going to be my TOTM soon so could be pms
746,k6pvrdh,comment,SageFreke86,COVID19positive,1698432748,It was gone in 2 days for me
747,k6phka5,comment,SageFreke86,COVID19positive,1698427530,I had random shooting ear pains that was on and off for 2 days but I also had Covid and flu so it could have just been like stress etc. it was in my temples too
748,k6pfu5x,comment,SageFreke86,flu,1698426904,YES! So all week I had/have the flu B and Covid. The first like 2 days I was sick I was peeing LIKE CRAZY! All night I would get up every 2 hours to pee and I wasn’t even drinking anything.  A family member caught the flu as well and same exact thing. They had a day/night where they barely drank and just peed constantly. For me though I actually did have a UTI. But the peeing is definitely from the flu too
749,k6pfjwa,comment,SageFreke86,COVID19positive,1698426799,Thanks! Yes it was only gone for 3 days so hopefully that’s a good thing and this virus is almost gone. Fingers crossed 🤞
750,k6pfdj5,comment,SageFreke86,COVID19positive,1698426734,I believe it. This virus is nuts
751,k6pf8ka,comment,SageFreke86,COVID19positive,1698426685,Luckily my sense of smell came back today and that cheered me up a lot. So it’s something atleast!! Thank you 💜
752,k6pevrq,comment,SageFreke86,COVID19positive,1698426555,Indeed 🥲😅. It’s been a hell of a week. Finally starting to slightly feel normal again. I still get fatigued if I’m out walking around for too long. So just been trying to take it easy for the most part. It’s been quite a plummit on my mental health as well.
753,k6ow1nf,comment,SageFreke86,COVID19positive,1698419657,I’m on day 8 Covid and flu B and I lost my sense of smell for 3 days. It just came back today
754,k6mfyqu,comment,SageFreke86,COVID19positive,1698370374,That’s what I feel is going on for me.  The first 6 days were respiratory and now it’s 💩 and the respiratory is mostly gone at this point. I haven’t regained my loss of smell yet though.
755,k6mf7kx,comment,SageFreke86,COVID19positive,1698370055,How long did the Hershey squirts last for you? Yeah today I just ate rice toast and pumpkin lol
756,k6mejpy,comment,SageFreke86,DogAdvice,1698369773,https://www.reddit.com/r/goldenretrievers/s/HRUYgBrYI6
757,k6mduwi,comment,SageFreke86,DogAdvice,1698369485,Is he a golden retriever? Apparently golden retrievers make these weird sounds (mine does too). Someone posted a video of it not too long ago in the GR Reddit. It’s so hard to describe the sound but it’s just his “happy sound”
758,k6lixit,comment,SageFreke86,Jeep,1698356533,I mean if you aren’t paying their payment/taxes then who cares honestly. The only thing that really gets under my skin with ANY off-road vehicle or truck is huge ass rims with rubber band tires lol
759,k6l0vy7,comment,SageFreke86,emetophobia,1698349969,I couldn’t take bactrim.  Call your doctor and tell them it makes you sick. I had the same issue so they gave me nitrofurantoin.  I had a UTI and they put me on bactrim and I was incredibly nauseous while taking it.
760,k6l0jrz,comment,SageFreke86,emetophobia,1698349852,Noro is puking n shitting your brains out at same time for hours
761,t3_17hoeg3,post,SageFreke86,COVID19positive,1698415792,Anybody else have their mental health take a huge drop since getting Covid? It’s my first time with Covid and I don’t know if it’s just the whole quarantine or what but I have been even more depressed than usual lol.
762,k6kb05v,comment,SageFreke86,COVID19positive,1698340766,Day 7 Covid and just got over flu. Started having the Covid diarrhea today after a week of respiratory symptoms and found myself even more depressed with these new GI symptoms. Also period is SUPPOSED to start in 4 days so could be pms. I also have PMDD and PCOS.  I feel your pain.i feel hopeless and like I will never get better and it’s terrifying. First time having Covid too.
763,k6ka7gu,comment,SageFreke86,psvr2,1698340483,"Only like 3. I am someone who has genuine motion sickness was though. I can’t be a passenger in a car more then 10 mins, can’t go on boats etc   So I should have known it wasn’t gonna work out for me lol"
764,k6jif21,comment,SageFreke86,psvr2,1698330230,I had to refund mine. Even tried playing it with a fan blowing on me and was still extremely nauseous
765,k6jfzg4,comment,SageFreke86,psvr2,1698329278,If you have motion sickness don’t bother. That’s my only advice lol. I bought the psVR2 when it launched and I had to return it to Sony because it made me extremely nauseous. Other then that it was pretty cool
766,k6jfqjn,comment,SageFreke86,emetophobia,1698329178,Covid and the flu are going around like crazy right now too.  I currently have both. If it happens it happens. We have to remind ourselves it’s a part of life.
