,id,type,author,subreddit,created_at,content
0,k8lq6b4,comment,sp00kens_,texts,1699589290,"Sorry dude. She literally said she didn’t see it going romantic. She made plans with you and her best friend and then (it seems like) she tried to dip and leave yall two by yourself? She’s trying to be nice and not hurt your pride/feelings, but she is being pretty clear that she is not interested in pursuing this romantically. It sucks, but you’ll find someone who you click better with! Good luck, dude!"
1,k8ks91w,comment,sp00kens_,deadbydaylight,1699574872,Yea I think the ranking system is weird. I don’t like that we can’t see our rank that pairs us with people and we can’t choose to play against more/less advanced players. I’ll go through a rough patch after a long break and be paired with total newbies and it just gets boring after a while
2,k8kroj4,comment,sp00kens_,deadbydaylight,1699574628,"I feel for you. I feel like (in my experience) I haven’t had enough people use anti hook builds to really annoy me all that much. Like, I’ve definitely had a few, and it’s like bruh. But I guess since they haven’t been as common for me, it’s more startling and feels more rewarding when I rehook the mf."
3,k8kr7q6,comment,sp00kens_,deadbydaylight,1699574429,"Yea. It’s super annoying when they do that :/ It’s like.. yea thanks for gloating. Especially when they crouch like a madman at gate/hatch or flash their light at you. Tho, I have been able to down someone right at gate with oni blood fury and hook them. Hopefully as I get better I can do shit like that more often. I doubt that player will taunt killers as often. Or at least they’ll think twice about it."
4,k8kqt0e,comment,sp00kens_,piercing,1699574258,"Thank you!!! Unfortunately I’m sick as hell and had a runny nose. I lost one of my screw hook spike studs so I need to get a new one :( wearing horseshoes now (which is still cool but not AS cool).
ALSO!!! Do it do it do it do it do it do it!!!!"
5,k8kqmh4,comment,sp00kens_,piercing,1699574182,"Hehe his name is Wyrm (pronounced Worm). He just got his manhood taken away from him. 
Also thank you!!!!!"
6,k8ja1ho,comment,sp00kens_,flu,1699554711,Oh no!! I hope you get the tamiflu soon! :’0
7,k8j9w5k,comment,sp00kens_,piercing,1699554658,Hhhh i kinda forgot. Want to say 8g tho
8,k8in3dx,comment,sp00kens_,flu,1699546461,"Update: no flu, no COVID, no strep. Not sure WHAT I’ve got. They gave me a steroid shot and an antibiotic shot though and prescribed me some anti mucus medication pearls. Taking the day off again to try to sleep now that I can breathe a little better. :’0"
9,k8ifmf6,comment,sp00kens_,piercing,1699543679,😩😩😩😩😩😩 Ily bahaha imy &lt;3
10,k8ifiqi,comment,sp00kens_,deadbydaylight,1699543639,Na I feel you. I kinda like loopers tho: I find it fun to outsmart them (or get really pissed off in the process of trying). Also some chase points never hurt. But I do see where you’re coming from haha
11,k8if5mg,comment,sp00kens_,piercing,1699543502,Shawty do NOT make me drive to VE rn and kiss you on the mouth (I’m sick: you do NOT want this)
12,k8idavw,comment,sp00kens_,facepalm,1699542795,"I just know they don’t wash their buttcrack….
Edit: forgot don’t"
13,k8hxirl,comment,sp00kens_,flu,1699536123,"Yea :( I for sure will! I haven’t had the flu in like years. I got covid twice though last year and the year before. It sucked but nowhere near this bad! I will keep you posted! 
Also how have your symptoms been? :’0"
14,k8hx4xm,comment,sp00kens_,flu,1699535942,"Yea I’m getting ready to go to the walk in right now: it hurt so bad. Even when I had covid I wasn’t in this much pain idek what’s going on. Other symptoms are more or less the same, but my chest being super filled with mucus is making me actually crazy"
15,k8hvjnj,comment,sp00kens_,flu,1699535177,"Morning update: finally crashed out at like 4AM. It’s now 7AM, and I can’t breathe. My chest is on FIRE. Feels like pneumonia and coughing and breathing hurts"
16,k8hb987,comment,sp00kens_,piercing,1699521696,If that’s the case I’d stick with bridge. It’s less likely to fuck up imo. (I’m Not a piercer tho so idk). Snakebites can go south real fast if someone screws them up (nerves and such)
17,k8hamn2,comment,sp00kens_,piercing,1699521182,"Bridge was easier than snakebites process wise for me! (I got my snakebites earlier this year, but haven’t posted them). My bf and I got them at the same time (his first piercing other than ears). Those also didn’t hurt but I have a weak stomach with piercing through thick parts of the skin for some reason so they grossed me out. My bf thought the second piercing hurt way more than the first. 
Make sure that regardless you go to a good piercer who will use good materials that honestly will make or break you!"
18,k8hadxs,comment,sp00kens_,piercing,1699520984,"Na ur good haha! Thank you: I hope to complete my face with replacing my vertical labret with a normal labret, getting my dimples done, high nostrils, and tongue &gt;:D 
My bridge didn’t hurt when it got pierced at all. I’ve had it for almost a year and a half I think, and it is honestly my most fussy piercing. It requires a lot of care with saline and will flare up if i wear any makeup or if there’s a lot of dust around. It’s never really painful tho, but it definitely likes to get irritated. I will also say, I get hairs stuck in it (my eyebrow piercings too).. buuut I shave my eyebrows so that’s the likely culprit. When that happens it uncomfortable but like not painful. 🫡 hope that helped!"
19,k8h9wst,comment,sp00kens_,piercing,1699520598,Hell yea! Update me on the tongue piercing process!! I have a fuckton of facial piercings but I rlly want a tongue: would love to hear how the process goes! 🫡🫡 goodluck with your piercing journey!!
20,k8h9ruf,comment,sp00kens_,piercing,1699520481,All of them
21,k8h9dz4,comment,sp00kens_,DrMartens,1699520161,"So I just broke in my Jaden maxes! It sucked :D BUT, I used these blister pads I got at CVS.. they’re like bubbled up and raised/padded. They worked really well. I layered like two-three of them (one on the lowest part of my foot, one right above it, and one in the middle), and paired it with two layers of socks (yea yea yea I know “friction”.. BUT I found that if I put on a thicker pair underneath a tight fitting pair it reduces the friction and is cushioning enough to actually walk in it). Alternatively, use some super thick socks with it, and wear them daily. Fr just wearing them is the key to breaking them in. It sucks, but after like 3-4 days of agony and wearing them constantly, they break in. (Also have to come with a forewarning that I now have a blister scar that is the side of my entire heel, so do with that what you will)"
22,k8h8u07,comment,sp00kens_,weed,1699519711,"As a Texan, I envy yall so bad rn"
23,k8h7sr3,comment,sp00kens_,flu,1699518860,"That’s what I heard too: crazy because yesterday (two days ago?) I felt fine except a postnasal drip, and today has been absolute hell on earth. Thankfully no puking. I don’t handle puke well at all. 
And I will! :’) I hope your symptoms aren’t bad and that you have a quick recovery!!"
24,t3_17r95hr,post,sp00kens_,piercing,1699521618,Realized I haven’t posted my setup in a minute. Getting my dimples done whenever I have money again :’) peep my kitty (he just got fixed). Ignore that I look dead: I have the flu :’0
25,k8h7jl9,comment,sp00kens_,flu,1699518653,"I definitely will! I haven’t noticed a fever but we don’t have a thermometer: my bf said I felt really hot but he was also cold to the touch from me. Going into the clinic first thing tomorrow!
Thank you!!"
26,k8h713a,comment,sp00kens_,flu,1699518237,"Uhhh day 2/3 (it’s 2:23 am where I am: can’t sleep). Idek if it’s flu, but it’s not covid, and if it’s a cold it’s sure a helluva cold. I am ready to rot away forever tho fr"
27,k8h5nj1,comment,sp00kens_,shittyfoodporn,1699517142,r/dontputyourdickinthat
28,k8h3uzj,comment,sp00kens_,shittytattoos,1699515751,Oh. Yea. That’s a green flag. /s
29,k8h3n9g,comment,sp00kens_,deadbydaylight,1699515586,I just like to complain.
30,k8gpl87,comment,sp00kens_,deadbydaylight,1699506254,The second I saw that picture I knew people would be thirsting 😩
31,k8gkn0g,comment,sp00kens_,deadbydaylight,1699503558,Aaaa i felt the last one like 😩😩😩 sometimes I’ll just let them take the w if I already feel helpless (happened OFTEN while learning nurse) and they would continue to flash me and tbag like their lives depended on it when the exit is already open and I’m just idling
32,k8geli6,comment,sp00kens_,deadbydaylight,1699500660,"Oh also would like to add: body blocking. Especially excessively. *pisses* me off to no end. Especially when they crouch below at the hook. It’s strat when it’s sometimes, but constant makes me angy."
33,k8gef2a,comment,sp00kens_,deadbydaylight,1699500578,"Okay lol that literally happened to me last match I played. But in their defense I was PLAYING with them and it was kinda mean. Last survivor (who had been kinda toxic anyways, but I was in a good mood bc I had already done a long string of 4K wins) was on wounded after I closed the hatch. I was initially going to down him and hook him but had a change of heart. I dropped him in front of the exit, let him open the door a bit, yoinked him, dropped him, yoinked him, dropped him, let him open the door, slugged him, and let him crawl to the exit at the last second before time ran out. Mans was shit talking in the chat after talkin bout my L. Like sir… I gave you that W, tf??"
34,k8gcddn,comment,sp00kens_,saw,1699499666,Post nut clarity
35,k8gc79r,comment,sp00kens_,weeviltime,1699499590,"I used to work at a sex shop. We would have these like sex toy meetings where a bunch of sex shops would meet with a bunch of sex toy vendors and the vendors would try to sell us the product. I shit you not, this lil guy was one of the products. Along with a long tentacle from one of the vendors. Can’t think of the name for the life of me tho. Didn’t think I’d be seeing him again… not in this reddit at least haha."
36,k8gboa7,comment,sp00kens_,texts,1699499359,"Man. This made me feel nasty asf. My boyfriend is definitely the cleanlier of the two of us and we live together but like when it was just me I hardly ever changed my sheets unless my cat pissed on them or something. In my defense tho, I suffer from extreme add and depression so the two combined forms this disgusting monster I call myself. I’ve been getting better (slowly but surely). Maybe… I should go buy another set of sheets"
37,k8g8gzp,comment,sp00kens_,deadbydaylight,1699497990,Boil over is definitely annoying. If people abuse it I usually resort to slugging. But honestly my biggest grovel about boil over is how I can NEVER get through a door. Like bruh.
38,k8g0yuv,comment,sp00kens_,deadbydaylight,1699494898,But I also main both pig and ghosty so I t-bag them right back
39,k8g0wrc,comment,sp00kens_,deadbydaylight,1699494876,Big agree tbh
40,k8g0uu0,comment,sp00kens_,deadbydaylight,1699494855,Hahahaha this is why most of my abilities are aura reading. I hate not knowing where to pressure it’s so stressful. Like bruh where tf ARE yall
41,k8g0nl2,comment,sp00kens_,deadbydaylight,1699494775,You are a right and just killer fr
42,k8fx99m,comment,sp00kens_,NSFL__,1699493408,Ayeee I saw the og post: this was so gnarly! Super cool you can see each tooth hole!!
43,k8fx44w,comment,sp00kens_,NSFL__,1699493351,Almost like.. He’s suffering the consequences of his actions.
44,k8fwvv5,comment,sp00kens_,deadbydaylight,1699493259,"I kinda love when people pre drop every pallet because they just waste it. I feel like it’s bad strat but a lot of beginners who don’t know how to loop do it. It’s always really rewarding when there’s like no more pallets on the side of a map you were on since one dumbass ruined it all. That being said tho, breaking all those pallets is annoying."
45,k8fwaa6,comment,sp00kens_,deadbydaylight,1699493017,Oh yea the standing at the exit irks me. Tho: I’ve been able to down someone with oni blood rage that way and it was pretty satisfying
46,k8ejrw3,comment,sp00kens_,saw,1699474525,I straight up cried not because it was scary but bc it was kinda sad idk it was good
47,k89vlb9,comment,sp00kens_,Depop,1699394498,If they cared about a refund that bad they wouldn’t have waited a month to try to get one.
48,t3_17r7h8q,post,sp00kens_,flu,1699513971,"Ugh. I feel so dramatic for this, but I’m at why wits end. I’ve had to call off for uni classes and likely will have to call off for work tomorrow too :/ It started as just a post nasal drip and VERY quickly escalated to my entire body hurting and aching, feeling fevery (but without a proper fever), sneezing, coughing, dizziness (probably from the congestion in my ears), chest pains, etc. I’m a pretty frequent weed smoker, and a sometimes vape partaker but have laid off of both since I started my symptoms. I can’t sleep. I feel like I can’t breathe. I’m too hot or too cold at any given moment, my body hurts, and it’s making me frustrated and cranky. If I’m feeling like shit in the morning I’m going to the doctor, but does this sound like flu? Is there anything that will actually help? I’ve tried DayQuil (I didn’t have niquil and didn’t feel like spending more money), Vic’s vapor rub, Vic’s vapor stick, yogi cold season tea, homemade garlic soup, chicken soup, zinc, zicam spray, cough drops, baths, steaming the room, Netti pot (idk if spelled right), drinking hella water. Nothing is helping. Not even temporarily. I feel like I’m losing my godamn mind."
49,t3_17r1brv,post,sp00kens_,deadbydaylight,1699492789,"Personally, I hate when I’m playing as killer, and they all run up on me and keep me in one place. It’s fun at first since it’s like chasing everyone all at once, but then it kinda forces you to slug, tunnel, and even camp. Like bruh it’s not fun when they’re no more mind games or chase. 9 times out of 10 it doesn’t even end up as a survivor win either. Just pointless and frustrating. Idk"
50,k89v93h,comment,sp00kens_,mildlyinfuriating,1699394374,"This is most definitely a child… right…? With all those spelling mistakes and how horrified they are
Of the decorations, I’d assume so"
51,k8982yp,comment,sp00kens_,saw,1699386016,"Exactly!! Absolutely think it’s winnable but for sure not for the faint of heart. I feel like if that really was a trap, it would be one of the very few traps I couldn’t handle. I don’t even have balls, and I can handle a copious amount of gore, blood, anything along those lines, but the second I stumble across some horrible ball mutilation I cringe so hard."
52,k87rbhg,comment,sp00kens_,piercing,1699366581,"Double nostrils and a septum would be fire. (If you had to chose one I’d say septum)
I feel like you’d look really good with a labret or a vertical labret lip piercing also! 
You’re so pretty!"
53,k87r1hz,comment,sp00kens_,deadbydaylight,1699366464,How much is he? (I got no auric cells so like real world $$$ ) imma buy him later today. Very excited to see this bad boy back. Fr wish I bought him before they pulled him but I was silly and a baby atp
54,k87piqt,comment,sp00kens_,saw,1699365802,Yes: EXACTLY. I feel like honestly it would be harder. Because in the real world people actually do stunts with meat hooks through flesh. BUT you don’t see many people hoisting themselves up by their balls irl.
55,k86b1id,comment,sp00kens_,trees,1699332285,Bruh this shit is straight up leaf clippings and stems rip
56,k85fca6,comment,sp00kens_,saw,1699318438,My bf and I always joke that a good trap for people who deserve genital mutilation would be to basically have to hoist themselves up by their sack or something sack equivalent
57,k85c46o,comment,sp00kens_,ATT,1699317136,I wil! Thank you so so so much
58,k85by28,comment,sp00kens_,facepalm,1699317065,Oh yea. He’s for sure touched a vagina before. 100% vagina certified. /s
59,k857o2k,comment,sp00kens_,UPS,1699315324,Okay. I guess I’ll just have to wait and hope it gets to AT&amp;T before I’m billed. Thank you for helping me :’)
60,k856wl7,comment,sp00kens_,UPS,1699315020,That’s concerning. Is there any unfortunate possibility that they didn’t trade it? Should I try to call to ask or ask at the local usps? I’m just tryna have some peace of mind: I feel so stupid for this
61,k856ews,comment,sp00kens_,UPS,1699314825,"Okay.. so there’s no way to find out if they did a swap or anything, huh? I feel like a dog chasing its tail rn fr"
62,k84okg5,comment,sp00kens_,Pristiq,1699308014,Haha I actually quit pristiq over the summer. The side effects started to take more of a toll than not being on anything did (mostly in the form of weight gain with.. with my circumstance and past ed made my depression actually flare up worse) Took months before I stopped withdrawal symptoms (even with tapering).
63,k83g9qb,comment,sp00kens_,HatMan,1699292362,You won Halloween that’s awesome
64,k802neo,comment,sp00kens_,weed,1699228741,Ngl that shit looks fire (maybe it’s the purple of the bag bringing out the purple of the bud but I would smoke that and prolly pass tf out)
65,k7j8nzs,comment,sp00kens_,coins,1698946327,Thank you! We figured but weren’t sure: definitely will check the FAQ next time
66,k7j7rhn,comment,sp00kens_,coins,1698946003,Haha I figured: ty. We were shocked that it listed so expensive online. Idk anything about coins tho
67,k7j6k5p,comment,sp00kens_,coins,1698945575,Is it like worth anything?
68,k7ghbiw,comment,sp00kens_,pumpkincarving,1698892953,Also want to add that the Jack one had such a clean cut too and is clean asf inside! It’s solid but a little common. (Still amazing) and the witch is super cute: getting those thin bits of pumpkin is HARD!
69,k7gg93v,comment,sp00kens_,pumpkincarving,1698892479,"Between 4 and 2… here’s my reasoning:
Number 4 has really solid curves and sharp edges, but is a simple pumpkin carve: no layering of pumpkin, and no extra steps. It’s a simple, classic (and very good) pumpkin carve. I will say, however the guts are pretty gangly inside. Which, while it isn’t THAT big of a deal, it definitely has to take off some points because a clean inside pumpkin is apart of the artistry itself. OVERALL, It is VERY clean tho: the lines are SOLID so it makes it a really impressive piece. Super iconic and recognizable character too! 
Number 2, however, is using a bunch of different techniques. While the lines aren’t as clean and precise, the organic feel of it makes is charming. It’s very recognizable as a pug, and the inside of that pumpkin is CLEAN. Those walls don’t have a scrap of pumpkin guts: it looks smooth as marble up in that bitch. Some of the inside lines are a lil choppy, tho, but overall the bold design, along with the cool layering/ opacity effects makes it super solid! Also points on creativity. 

Everyone had such cute pumpkins&lt;3"
70,k7emf8g,comment,sp00kens_,musicsuggestions,1698866705,Omg I’m so jealous: I love crass
71,k7e4vuo,comment,sp00kens_,relationship_advice,1698860327,That’s abuse. Whether pregnant or not. Physical and verbal and then she played it off like nothing. Being pregnant is no excuse for being abusive and horrible to your partner: fuck that
72,k7e2wnz,comment,sp00kens_,saw,1698859612,I think it was a pre-movie teaser I found somewhere it gave a Billy teaser before the movie but idk. Hopefully it becomes a more complicated ARG
73,t3_17pgsnp,post,sp00kens_,UPS,1699314284,"Hi everyone. Before anybody calls me a stupid idiot, I already know. So, basically, I finally traded in my old iPhone for a newer phone, and got everything set up. Everything was all good until I realize that my tracking for it never updated even though I sent it in about two or three weeks ago. I went to the website to try to track it and realize that it was tracking through, UPS/FedEx. On the website it said to drop off at a UPS location, but the IMEI/ESN/Serial number sent me to a FedEx link so I’m not sure which one is correct. I made the silly blunder of dropping off my package at USPS since I misheard the person in the AT&amp;T store when they told me what carrier to bring it to and I didn’t think to check the label because again I’m a stupid idiot. I tried calling AT&amp;T, but they were no help. I tried to call USPS, but I don’t have a USPS tracking number and the automated robot wouldn’t send me to a representative without it. I tried to call UPS, but the robot refused to let me speak to a representative and the tracking number that I have doesn’t match anything on record. Can anybody help me? i’m kind of freaking out because if it doesn’t get there before 14 November, I’m gonna be charged around $200 for the late fee and I really can’t afford that right now. Any help is amazing, again I’m sorry I’m so dumb."
74,t3_17ph06p,post,sp00kens_,ATT,1699314890,"AT&amp;T phone trade in brought to the wrong carrier — plz help.. I posted on ups reddit too. Yall im so exhausted idk what to do 

Hi everyone. Before anybody calls me a stupid idiot, I already know. So, basically, I finally traded in my old iPhone for a newer phone, and got everything set up. Everything was all good until I realize that my tracking for it never updated even though I sent it in about two or three weeks ago. I went to the website to try to track it and realize that it was tracking through, UPS/FedEx. On the website it said to drop off at a UPS location, but the IMEI/ESN/Serial number sent me to a FedEx link so I’m not sure which one is correct. I made the silly blunder of dropping off my package at USPS since I misheard the person in the AT&amp;T store when they told me what carrier to bring it to and I didn’t think to check the label because again I’m a stupid idiot. I tried calling AT&amp;T, but they were no help. I tried to call USPS, but I don’t have a USPS tracking number and the automated robot wouldn’t send me to a representative without it. I tried to call UPS, but the robot refused to let me speak to a representative and the tracking number that I have doesn’t match anything on record. Can anybody help me? i’m kind of freaking out because if it doesn’t get there before 14 November, I’m gonna be charged around $200 for the late fee and I really can’t afford that right now. Any help is amazing, again I’m sorry I’m so dumb."
75,k7e2h16,comment,sp00kens_,musicsuggestions,1698859457,"Not to pat myself on the back or anything, but I know lol. I used to work at a record store and spin records for events so it comes with the territory haha 🫡"
76,k73sm3t,comment,sp00kens_,cats,1698682572,https://preview.redd.it/dedgjzme7dxb1.png?width=3024&amp;format=png&amp;auto=webp&amp;s=9454b52dc9b55ff58173446973c7da3a86d810a3
77,k73qxi5,comment,sp00kens_,deadbydaylight,1698681940,This is hilarious omfg
78,k70tepg,comment,sp00kens_,saw,1698622934,"Haha just filled the information but just got a link to a screenshot of an eye, a heart, and a saw (I &lt;3 saw) but the
Message was saying to message back to solve the riddle but nothing happened :("
79,k70s873,comment,sp00kens_,saw,1698622442,"What happens if you text it? Omg I called it, but haven’t had the chance to text. It’s not like crazy personal info is it? hahaha super cool Easter egg"
80,k70rcbo,comment,sp00kens_,painting,1698622078,Wow the colors are so yummy
81,k70r6cv,comment,sp00kens_,shrooms,1698622011,My bf and I have sex quite often on shrooms. My favorite is when I’m tripping and He’s not since when we’re both tripping sometimes we just get confused and stop BUT idk I always feel like I’m skipping through time. It’s wonderful and nice time to connect on a deeper level
82,k70oyvu,comment,sp00kens_,saw,1698621130,Does anyone know if he had to do each finger individually? Or could he just have turned the dial all the way and broke them all and got it over with? That’s what I would’ve done at least if that was an option
83,k70nlbw,comment,sp00kens_,saw,1698620584,Second this
