,id,type,author,subreddit,created_at,content
1517,j5aovfe,comment,Unable-Raisin7013,halifax,1674320250,How you feeling now? In a similar situation now!
1518,j4ut2tj,comment,Unable-Raisin7013,AskUK,1674044429,Anyone have terrible fatigue and weakness once the other symptoms stopped?
1519,j0w7aqn,comment,Unable-Raisin7013,bikewrench,1671486194,"It has a thru axle in currently and the front is running a thru axle (from the wheelset) I had to use the QR converters to use as a QR wheel on my other bike…

https://www.edinburghbicycle.com/mavic-9mm-rear-adapters-v2510801?gclid=Cj0KCQiAtICdBhCLARIsALUBFcFy-7UCT8niLY7idW9UfSr3-girXANtFr4hANuwrXKkFVNU6r5_PSIaAq8aEALw_wcB

I was using this for it.

Could it be this?

https://www.tradeinn.com/bikeinn/en/mavic-rear-axle-adapters/136622707/p?utm_source=google_products&amp;utm_medium=merchant&amp;id_producte=5832524&amp;country=uk&amp;gclid=Cj0KCQiAtICdBhCLARIsALUBFcFZUyk-8r1BUn6QeVvh82vHDcMmI4W-fQU5zzBmXdxy1MzFV80QhPAaAiRvEALw_wcB&amp;gclsrc=aw.ds"
1520,j0vugn0,comment,Unable-Raisin7013,bikewrench,1671481118,https://preview.redd.it/s0dpl1zhfy6a1.jpeg?width=3024&amp;format=pjpg&amp;auto=webp&amp;s=7fe5ffa3b7701bf3ef634ead3412cccac5b763de
1521,i5mss9m,comment,Unable-Raisin7013,bikecommuting,1650557657,"I commute all year in the north of England (West Yorkshire, so a fair amount of hills!) The right clothing is a must. For winter I use 28mm tyres/continental 4 seasons and then mechanical disc brakes are a great!"
1522,hzr4im1,comment,Unable-Raisin7013,bikewrench,1646687357,"5 years of commuting :( a sad day! Looks like the summer bike is coming out early.

May just pop it on a trainer for its final usage!"
1523,t3_tkdy9k,post,Unable-Raisin7013,bikewrench,1647985341,
1524,t3_zq2bro,post,Unable-Raisin7013,bikewrench,1671481090,"Can someone please point in me in the right direction of the correct adapter I need? Cassette side, to allow for thru axle/hub coverage. Previously used on a QR bike…"
1525,t3_12kewrj,post,Unable-Raisin7013,zoloft,1681367819,"I’ve been on 50mg for around 8 weeks. These past two weeks or so I’ve been getting horrendous tension headaches, skin hurts, diarrhoea, night sweats again. Mentally I’ve been feeling good again but these side effects are ruining things! 


I did drink a few pints a week ago and ended up with a hangover that lasted for 5 or so days! 

Doctor has suggested coming off for a few days or so to see whether the physical aspects improve and then changing SSRI.

Anyone had any such experience? Or had to change SSRI? What was it like?"
1526,t3_13c1tz9,post,Unable-Raisin7013,bikewrench,1683573609,"Correct inner tube size, tried several. Tyre won’t seat fully when pumped up… tried another tyre also. Wheel issue?"
1527,t3_11nyk8l,post,Unable-Raisin7013,zoloft,1678476994,"Hi all!

Been on 50mg of Zoloft now for 24 days for depression/anxiety. Initial spike of extreme anxiety which is now gradually fading alongside fatigue. Not a sense of needing to sleep but just less energy. I’m used to having a lot of energy! Does this tend to return fully in others people’s experiences? 

Wishing everyone luck on their journey"
1528,t3_ygeir1,post,Unable-Raisin7013,bikewrench,1667033538,Are thru axle lengths specific to wheels or the frame? I have a front axle that’s 125mm in length but a new wheelset requires a 100mm. Is it just a case of swapping out the axle?
1529,t3_thcp1e,post,Unable-Raisin7013,bikewrench,1647630741,"Hello!

I have mechanical rim brakes and the right lever, front brake has a rattle. It ceases if my hand is in it… already tightened the main clamp bolts (they were fine already) any other little screws/bolts that could be the culprit?"
1530,hvk5mxf,comment,Unable-Raisin7013,funny,1643982114,Dicklodocus
1531,t3_rz72ma,post,Unable-Raisin7013,bikewrench,1641668368,"Hi,

On my winter steed one of the caps has fallen off:

[link to said part ](https://www.bikeinn.com/bike/mavic-12mm-road-axle-cap-qrm-auto/137141954/p?utm_source=google_products&amp;utm_medium=merchant&amp;id_producte=8552795&amp;country=uk&amp;gclid=Cj0KCQiAieWOBhCYARIsANcOw0yQhF635rUhfvGYrqsddLP5zUjC2ccGl6XVg8Em33bra26rdFAgeM8aApmDEALw_wcB&amp;gclsrc=aw.ds) 

How do I reinstall? 

Forgive my ignorance!"
1532,t3_t8yldz,post,Unable-Raisin7013,bikewrench,1646684834,
1533,k7xc52k,comment,CookieFlirtyDough,heartbreak,1699192133,"There is a difference between “a break without any time limit” and “some space to re-evaluate things”. 

Here’s what’s gonna happen, OP: 

1) She might get back to you whenever she wants and slowly tell you about the other men she tried seeing during the “break” which will break you to a point of no repair. 

2) She will never come back but won’t let you date anyone else too because she won’t be sure herself if she wants to come back or not. 

In both the situations, you will suffer. 

The right thing to do here would be - communicate with her regarding the boundaries during this “break” of hers and tell her that you also have an equal part in this relationship, you don’t wanna be hanging in the middle - so another conversation with more rules would be better. And you’ll also get an idea about what exactly is she thinking through her body language/tone of voice. 

Take good care, OP!"
1534,k7xab71,comment,CookieFlirtyDough,Tinder,1699191299,"I love this profile! Hope you find someone really nice, super soon."
1535,k7tsueo,comment,CookieFlirtyDough,AskReddit,1699125641,Been there. Sucks
1536,k7traao,comment,CookieFlirtyDough,AskReddit,1699125072,"This one time, I was dating my team mate in a corporate setup. He would never initiate “sexy time”. After waiting for two months, he finally agreed to spend some alone time with me, turned out that he had an ED. 

Now, he is married to somebody (arranged marriage) and she cannot stop stalking me on my socials. Lmao. God bless her."
1537,k7tofgw,comment,CookieFlirtyDough,heartbreak,1699124035,"What do you mean by coping? I have not left my bed today. Have spent hours watching movies on breakups (trying to feel better) but instead ended up crying for hours. Binge eating and smelling bad cause I don’t have the energy to get up and take a bath. 

But hey, everything will be fine soon :)"
1538,k78u71y,comment,CookieFlirtyDough,German,1698768557,"Thank you for this, very helpful. Wishing you good luck too :)"
1539,k78u1s3,comment,CookieFlirtyDough,German,1698768503,Thank you :)
1540,k77bikn,comment,CookieFlirtyDough,German,1698739361,Thank you for this :)
1541,k65kv4r,comment,CookieFlirtyDough,BPD,1698092820,The exact words my ex said. It hurts like a bullet.
1542,k65kc1y,comment,CookieFlirtyDough,BPD,1698092635,"My mother keeps saying “if I had told my parents that I am not able to work because I’m going through a depressive cycle, they would have kicked me out and I would have been homeless. Be grateful that you have me as your mother.” 

It kills me so deeply because usually whenever she says this, I’m trying to share about what’s happening and how miserable I have been feeling through the low days.

P.S. I belong to a Nation where kids don’t move out at 18, rather stay with their parents throughout their lives."
1543,k5yz57x,comment,CookieFlirtyDough,BingeEatingDisorder,1697985941,Count me in :)
1544,k4tr4ri,comment,CookieFlirtyDough,BPD,1697279013,"23. The Psychologist who diagnosed me said that it was serious and my BPD was high on neuroticism. When I went to my Psychiatrist, he looked at my diagnosis (he suggested me to get diagnosed so that the medications can be given according to the diagnosis), he shrugged the diagnosis saying “see, it’s ONLY BPD. Then what is the reason of having such severe breakdowns. You have to work on yourself in therapy, along with medicines.” 

And ever since, I started feeling that BPD is just nothing? It’s not even a disorder per say. It’s just stupid. It took me 3 years to come out of denial and actually start working on it and realising how big of a deal is it and how badly have I suffered throughout my life. 

I did not need my Psychiatrist’s validation after all. 

P.S. I’m still with him, his medicines have tremendously helped me through the years for which I’m very grateful."
1545,k4h4w7z,comment,CookieFlirtyDough,heartbreak,1697059919,Surely. Thank you :)
1546,k4h4u94,comment,CookieFlirtyDough,heartbreak,1697059898,Thank you for writing this. You made my day
1547,k4h4ram,comment,CookieFlirtyDough,heartbreak,1697059868,You think going NC would be the safe way out? Considering he is in the same vicinity and keeps coming to my place as well
1548,k4e8674,comment,CookieFlirtyDough,heartbreak,1697016038,😅😅
1549,k1uaelf,comment,CookieFlirtyDough,AskIndia,1695468836,"Probably the way he is carrying himself (not lousy), and his shoes"
1550,k1ua7eq,comment,CookieFlirtyDough,AskReddit,1695468708,"My dog was sitting right behind me, looking at me with her puppy eyes. While I made sure that she was locked in the other room, I still don’t know how was she sitting behind me. 

But I looked at her and her eyes and face. And then felt like “who will look after her after I pass? She will be so lonely” and I just could not do that to her. I stopped. Ever since, I spend a good amount of time with her now. 

The thoughts are still there but I don’t think i’ll ever be able to forget that face of hers, ever."
1551,k1u8g6n,comment,CookieFlirtyDough,TwoXIndia,1695467579,"The sad part is - these people don’t care how badly they’ve broken us. I hope you recover soon, OP."
1552,jv25qpl,comment,CookieFlirtyDough,SebDerm,1691346240,Thank you for this
1553,jv23z3t,comment,CookieFlirtyDough,AskReddit,1691345524,Barbie
1554,jun2vpv,comment,CookieFlirtyDough,abusiverelationships,1691081320,"It all makes sense. We often start becoming like the person we endure abuse from, and it’s unfortunate but it does make sense during that time and the guilt comes later that could we. But I want you to know that you’re doing so well, with the therapy, the medications and the exercise. This all will slowly start to pain a little less very soon. These three things have been helping me too, and I’m sure these will help you too. Just keep on standing up for yourself and showing up in therapy. And you can DM me if you ever wanna talk. Sending light and hugs"
1555,t3_17581h3,post,CookieFlirtyDough,heartbreak,1697008338,"I (27F) met a guy (29M) early September. Everything was magical and he treated me well. He took care of my emotional needs and was always there when I needed emotional support. Things were moving rather “too” quickly and my family also warned me about it saying “Don’t go too fast, don’t wanna see you get hurt.” 

Today, it’s been two days since he decided that he needed “space”. We used to sleep together on video calls every night and suddenly that’s gone. We used to text/call the entire day and knew each others’ whereabouts. Now that’s gone. He called me last night though, to ask for help as his payment wasn’t getting through and he needed to pay for his cab (it was a legit situation). But ever since, he has been unreachable again. 

Couple of things which happened during this month: 

- He moved to my vicinity, I arranged everything for him. From finding the apartment till settling in. 
 
- He demanded a lot of time from me, and I gave him all my attention, keeping all of the other stuff/work aside - like a fool. 

- Whenever I demand the same, he has been unable to show emotions or be there emotionally like he used to. 

- Yesterday, I was at his place and he served lunch for himself and ate it. I know it’s not a big thing but it was a huge deal for me as I did not eat anything (because he fought with me a night prior) and he did not even ask me if I would like to have lunch (that’s basic courtesy). On the other hand, he has managed to eat really nicely at my place, a lot many times and a lot many meals (I don’t regret it). 

There is a lot more but I think I’m experiencing trauma and my already existing trauma wounds are being re-ignited. 

I feel like I’m being severely disrespected."
1556,t3_17kf468,post,CookieFlirtyDough,German,1698735657,"Hi everyone! I am really passionate about learning German but due to financial constraints, I am unable to enrol myself for professional tutoring like A1 etc. 

I have been learning German on Duolingo since 100 days now and it has been amazing. But I feel like I need something solid. 

Are there any free resources which are creative and help us learn German like a course or a classroom format? 

I do watch YouTube videos of German with Anja etc. I am looking for a course kinda thing which would force me to write and make notes etc. 

Any help would be appreciated."
1557,t3_177mki9,post,CookieFlirtyDough,acne,1697279618,"Hi, I have been struggling with acne for almost over 5 years now. Took so many meds and changed so many doctors. 

Does anyone know which all Endocrine/Hormonal Tests can I get done to help my physician find the root cause of this? I’m tired honestly."
1558,jum3dj4,comment,CookieFlirtyDough,BPD,1691067487,"I even spend the next two hours thinking how I would never talk that person again, no matter since how I long I know them - all this while crying"
1559,jum20fw,comment,CookieFlirtyDough,AskReddit,1691066840,I don’t want to wake up in a stranger’s bed!
1560,jum1wdm,comment,CookieFlirtyDough,BPD,1691066787,I would absolutely want to get ride of Impulsivity!
1561,jum1tma,comment,CookieFlirtyDough,BPD,1691066751,SAME
1562,jum1jwm,comment,CookieFlirtyDough,abusiverelationships,1691066622,"It’s so insane that they try to play this card with us and it works on us too! *used to* anyway, I’m glad you broke free from the trance phase &lt;3"
1563,jum0w88,comment,CookieFlirtyDough,abusiverelationships,1691066312,"I know it hurts. I know it’s difficult to sleep. I know it feels like “why didn’t I get to see his good side which he has with her?” But trust me OP, you have no idea how badly the new girl is gonna suffer. She is gonna go through the same cycle of love bombing, abuse and then rewards and guilt. It’s gonna be as difficult for her to leave. But as difficult as it may sound, it’s not our job to make the other girl realise that the man we dated is an abuser. It’s difficult, but it’s NOW her own journey. You did what you could. And I strongly suggest you to block both of them and any trace of them on all social media platforms, otherwise it’ll be really difficult for you to find the meaning in your life again - in this healing journey. Rooting for you OP &lt;3"
1564,ju8kpw8,comment,CookieFlirtyDough,abusiverelationships,1690828854,My ex wanted me to believe that I was a narcissist just because I finally started standing up to his abuse. This is real. They wanna control you and this is mere Manipulation!
1565,jtztwih,comment,CookieFlirtyDough,SebDerm,1690666426,"Hey, how to use the mct c8 oil?"
1566,jtzs3zw,comment,CookieFlirtyDough,abusiverelationships,1690665669,Same +1
1567,jti466o,comment,CookieFlirtyDough,SebDerm,1690365395,Mine is Tacrolimus Solution 0.1%
1568,jti43md,comment,CookieFlirtyDough,SebDerm,1690365341,So my doctor asked me to use it every day for 15 days and then keep using it on alternative days for another month??????
1569,jtfckcc,comment,CookieFlirtyDough,SebDerm,1690313798,"How real is the skin cancer thing? I have read it too and currently using it for my sebderm, prescribed by the doc"
1570,jtcv8jo,comment,CookieFlirtyDough,TwoXIndia,1690270787,"“All your scars are a part of me, as I’m in love with you and all the parts of you which you dislike. You’re home” P.S. he was referring to my life saving surgery scars"
1571,jtaozmp,comment,CookieFlirtyDough,AskReddit,1690231182,Friends who just call to talk about what went wrong with them today
1572,jtamdqz,comment,CookieFlirtyDough,Faridabad,1690230198,Where did you get those plant vases from? So aesthetic
1573,jt3etg8,comment,CookieFlirtyDough,AskReddit,1690096394,You aced the actual meaning of satisfaction for her
1574,jsf86x7,comment,CookieFlirtyDough,scuba,1689661465,"Nope, he didn’t ask anything like that either"
1575,js2mtd4,comment,CookieFlirtyDough,LongDistance,1689433357,4 months!!!! We got this
1576,jrtd34y,comment,CookieFlirtyDough,delhi,1689262893,Is it okay to go from Faridabad - Gurgaon?
1577,jpelpql,comment,CookieFlirtyDough,delhi,1687648921,Hell yeah
1578,jpea8jl,comment,CookieFlirtyDough,delhi,1687643209,"“I love you, in a really, really big – pretend to like your taste in music, let you eat the last piece of cheesecake, hold a radio over my head outside your window – unfortunate way that makes me hate you, love you. So pick me. Choose me. Love me.” - Meredith Grey"
1579,jolyj64,comment,CookieFlirtyDough,nope,1687111140,My worst nightmare just came true in this video
1580,joltuz6,comment,CookieFlirtyDough,abusiverelationships,1687109039,"Thank you for this, listening and resonating with it."
1581,t3_14ik3x4,post,CookieFlirtyDough,BPD,1687693011,"To my fellow BPD warriors - does this happen to you too? 

I keep thinking about fame and how to get famous. I don’t think about the money which I’m required to earn but just the fame part. 

I am on a right path right now, completing a degree which was long due in a field I’m most passionate about. But whenever I watch something - I keep thinking about switching my field and put all of my efforts and somehow just get very famous. I keep thinking fame is what I want. 

But then whenever I have acted on this impulse, I have never succeeded. I have failed businesses, a successful music career and now finally when I’m at the right path of having a stable job in some months, my impulse is coming back again. 

Rather than focusing on my work tasks, I go into day dreaming and become very excited as to how will I get that fame and power? 

Is this abnormal? Does this happen with you as well? If yes, then how do you deal with it?"
1582,t3_152pye9,post,CookieFlirtyDough,scuba,1689660131,[removed]
1583,jod5zkp,comment,CookieFlirtyDough,disability,1686931708,Yesssss! How do we paste it?
1584,jod5y25,comment,CookieFlirtyDough,disability,1686931691,Aaah! This is actually interesting. Thank you
1585,jmu6lsq,comment,CookieFlirtyDough,AskReddit,1685864177,"Lip balm, wallet, keys - holy grail!"
1586,jmu69pr,comment,CookieFlirtyDough,abusiverelationships,1685863893,Thank you for this. But what would be my first step? I feel so lost.
1587,jlkhfn7,comment,CookieFlirtyDough,TwoXIndia,1685025020,"Yes I know. And I also felt harassed. Don’t worry, just hold on strong. Its our right and cant keep on denying"
1588,jljkbsm,comment,CookieFlirtyDough,TwoXIndia,1685007020,"Yeah, got it but had to give them a “male” guarantor. It sucks."
1589,jli5219,comment,CookieFlirtyDough,Adulting,1684975561,"Wow! This is a lot of work. You’re doing amazing, OP! Proud of you. You do you. There is no right or wrong, we navigate our rights and wrongs ourselves during depressive episodes and I’m proud of you for trying &amp; eventually succeeding at it. You’re not alone. Keep at it!"
1590,jli4m5c,comment,CookieFlirtyDough,indiasocial,1684975363,How will I sleep now
1591,jli4jbw,comment,CookieFlirtyDough,AskReddit,1684975328,Calm down (selena gomez version).
1592,jli4fu3,comment,CookieFlirtyDough,TwoXIndia,1684975284,The loan issue is very serious. I suffered a lot cause they wont give home loans to “single” very well earning “woman”.
1593,jlhyf0c,comment,CookieFlirtyDough,delhi,1684972607,Thank you for this today
1594,jl837pc,comment,CookieFlirtyDough,AskReddit,1684799355,Courage the cowardly dog! Made me feel “at home” during my childhood
1595,jl7wn9y,comment,CookieFlirtyDough,AskReddit,1684796377,"A guy driving a black Suv, wearing a metallic strapped watch. Aaah! Oomph! 🤓"
1596,jl7syr6,comment,CookieFlirtyDough,AskReddit,1684794725,"The fact that sometimes, they keep wearing the ugly looking *very high* heels which tbh looks uncomfortable. And the guy conveniently takes of all her clothes but somehow forgets to take off the heels till the very end. It somehow feels so superficial and uncomfortable. Like doesn’t women’s comfort matter? 

Idk. This might be stupid. Lol"
1597,jh6mozl,comment,CookieFlirtyDough,AskReddit,1682105901,"Guys driving a black SUV, wearing a proper dial watch (metallic) and just driving really fine. I cannot explain why but it turns me on like anything. Odd?"
1598,jbu5yuv,comment,CookieFlirtyDough,mildlyinfuriating,1678561670,"Please make sure to give him a flight of his own next time. 
And please make sure that the airline reimburses the money of everyone else sitting in that fight."
1599,jb3zagf,comment,CookieFlirtyDough,meirl,1678084666,Wow
1600,jakzv4h,comment,CookieFlirtyDough,InstaCelebsGossip,1677730640,"I strongly believe that it’s her insecurities leading her to put makeup like this. She has always been around, was not *always* this bad. I think with everything going on in her life, people must have made her insecure of a lot of things and I think she is just acting on those insecurities to *feel pretty*. 

Also, I’m sure that these influencers are on this page anonymously. If I were Kritika, I would legit cry for a day because of OP’s language. I think we should put our point out but also keep in mind that world has been so tough to all of us after C*vid. Let’s at least be a little nice to other human beings."
1601,jafgl11,comment,CookieFlirtyDough,SuperMorbidlyObese,1677633977,"The last one means so much! I know cause I would want that so bad, along with others of course. But the pedicure chair pain, only few “truly” understand 🌸"
1602,jafevid,comment,CookieFlirtyDough,abusiverelationships,1677633195,And that makes sense. Thank you for sharing this. I’m sure it’ll help other people as well.
1603,ja6b5qc,comment,CookieFlirtyDough,abusiverelationships,1677470242,"I just wanna say one thing - YOU ARE SO BRAVE! So so brave. Hold on to life, you will find someone who will actually be your *best friend* and won’t use your past as a benefit. Hold on tight. 

And therapy, if it’ll ever be possible. Don’t think twice before going for it. 

Thank you for taking out time and being so open about it here. It takes a lot to visit past trauma. I wish you healing."
1604,t3_13zkwpm,post,CookieFlirtyDough,abusiverelationships,1685816320,"When does this stop? There was so much pain in leaving the trauma bonded abusive relationship &amp; take a stand for myself (cause I never did that before) - and now that I’m out of it, there is so much pain involved in learning to exist alone. 

“I wanna go back, oh he used to abuse you, maybe he’ll change, you gave him another chance, I dont know how to be alone, you were alone with him too.” These thoughts keep running in my head 24/7. I’m tired of the contradiction happening in my brain. 

Before you say anything, I’m already in therapy. But sometimes you cannot explain what you’re actually going through, specifically in such complex trauma.

I miss the old me, I want a new me. But I’m stuck romanticising an abusive relationship."
